country_code,country,continent,publications,cited_by_count,institutions,authors
OM,OM,Unknown,1,3613,Aston University; Bournemouth University; City University of Hong Kong; College of Charleston; Delft University of Technology; Fore School of Management; Free University of Bozen-Bolzano; Friedrich-Alexander-Universität Erlangen-Nürnberg; Georgia State University; Humans and management in society; Indian Institute of Management Ahmedabad; Indian Institute of Management Bangalore; Indian Institute of Technology Delhi; King Abdulaziz University; King Fahd University of Petroleum and Minerals; Laboratoire d'Economie et de Management de Nantes Atlantique; Liverpool John Moores University; Middle Georgia State College; Montpellier Business School; NIIT (India); National Institute of Technology Tiruchirappalli; National Tsing Hua University; Northumbria University; Oklahoma State University; Prin. L. N. Welingkar Institute of Management Development and Research; SKEMA Business School; Sultan Qaboos University; Swansea University; Symbiosis International University; TBS Education; UNSW Sydney; Universidad de Zaragoza; University of Arkansas at Fayetteville; University of Bedfordshire; University of Bologna; University of Bristol; University of Colorado Boulder; University of Greenwich; University of Johannesburg; University of Louisville; University of Manchester; University of North Carolina at Greensboro; University of Otago; University of Reading; University of Sheffield; University of South Florida; University of Strathclyde; Worcester Polytechnic Institute; Wright State University,Abbas Mardani; Abdullah M. Baabdullah; Adil S. Al-Busaidi; Alex Koohang; Alexander Richter; Anand Jeyaraj; Arpan Kumar Kar; Bernd Carsten Stahl; Carlos Flavián; Denis Dennehy; Dimitrios Buhalis; Emma Slade; Emmanuel Mogaji; Fevzi Okumus; Frantz Rowe; Gareth H. Davies; Giampaolo Viglia; Hanaa Albanna; Ilias O. Pappas; Indranil Bose; Iris Junglas; Jan Pries‐Heje; Janarthanan Balakrishnan; Jeretta Horn Nord; Jochen Wirtz; John S. Edwards; Kai R. Larsen; Laurence Brooks; Laurie Hughes; Lemuria Carter; Manju Ahuja; Manoj Tiwari; Marcello Mariani; Margherita Pagani; Marijn Janssen; Mei‐Chih Hu; Michael Wade; Mousa Ahmad Albashrawi; Neeraj Pandey; Nir Kshetri; Nishith Pathak; Nripendra P. Rana; Paul Jones; Paul Latreille; Paul Walton; Rahul Dé; Ramakrishnan Raman; Rameshwar Dubey; Robert M. Davison; Robin Gauld; Rohita Dwivedi; Ryan Wright; Samuel Ribeiro‐Navarrete; Sangeeta Khorana; Sascha Kraus; Savvas Papagiannidis; Scott W. Cunningham; Siobhán O’Connor; Soumyadeb Chowdhury; Sriparna Basu; Sunil Mithas; Suprateek Sarker; Sven Laumer; Sven‐Volker Rehm; Tegwen Malik; Tom Crick; Varun Grover; Vishnupriya Raghavan; Viswanath Venkatesh; Wil van der Aalst; Yanqing Duan; Yogesh K. Dwivedi; Yves Barlette
ZA,South Africa,Africa,1,3613,Aston University; Bournemouth University; City University of Hong Kong; College of Charleston; Delft University of Technology; Fore School of Management; Free University of Bozen-Bolzano; Friedrich-Alexander-Universität Erlangen-Nürnberg; Georgia State University; Humans and management in society; Indian Institute of Management Ahmedabad; Indian Institute of Management Bangalore; Indian Institute of Technology Delhi; King Abdulaziz University; King Fahd University of Petroleum and Minerals; Laboratoire d'Economie et de Management de Nantes Atlantique; Liverpool John Moores University; Middle Georgia State College; Montpellier Business School; NIIT (India); National Institute of Technology Tiruchirappalli; National Tsing Hua University; Northumbria University; Oklahoma State University; Prin. L. N. Welingkar Institute of Management Development and Research; SKEMA Business School; Sultan Qaboos University; Swansea University; Symbiosis International University; TBS Education; UNSW Sydney; Universidad de Zaragoza; University of Arkansas at Fayetteville; University of Bedfordshire; University of Bologna; University of Bristol; University of Colorado Boulder; University of Greenwich; University of Johannesburg; University of Louisville; University of Manchester; University of North Carolina at Greensboro; University of Otago; University of Reading; University of Sheffield; University of South Florida; University of Strathclyde; Worcester Polytechnic Institute; Wright State University,Abbas Mardani; Abdullah M. Baabdullah; Adil S. Al-Busaidi; Alex Koohang; Alexander Richter; Anand Jeyaraj; Arpan Kumar Kar; Bernd Carsten Stahl; Carlos Flavián; Denis Dennehy; Dimitrios Buhalis; Emma Slade; Emmanuel Mogaji; Fevzi Okumus; Frantz Rowe; Gareth H. Davies; Giampaolo Viglia; Hanaa Albanna; Ilias O. Pappas; Indranil Bose; Iris Junglas; Jan Pries‐Heje; Janarthanan Balakrishnan; Jeretta Horn Nord; Jochen Wirtz; John S. Edwards; Kai R. Larsen; Laurence Brooks; Laurie Hughes; Lemuria Carter; Manju Ahuja; Manoj Tiwari; Marcello Mariani; Margherita Pagani; Marijn Janssen; Mei‐Chih Hu; Michael Wade; Mousa Ahmad Albashrawi; Neeraj Pandey; Nir Kshetri; Nishith Pathak; Nripendra P. Rana; Paul Jones; Paul Latreille; Paul Walton; Rahul Dé; Ramakrishnan Raman; Rameshwar Dubey; Robert M. Davison; Robin Gauld; Rohita Dwivedi; Ryan Wright; Samuel Ribeiro‐Navarrete; Sangeeta Khorana; Sascha Kraus; Savvas Papagiannidis; Scott W. Cunningham; Siobhán O’Connor; Soumyadeb Chowdhury; Sriparna Basu; Sunil Mithas; Suprateek Sarker; Sven Laumer; Sven‐Volker Rehm; Tegwen Malik; Tom Crick; Varun Grover; Vishnupriya Raghavan; Viswanath Venkatesh; Wil van der Aalst; Yanqing Duan; Yogesh K. Dwivedi; Yves Barlette
EG,Egypt,Africa,1,1704,Kafrelsheikh University,Ahmed G. Gad
BE,Belgium,Europe,1,791,Erasmus Hospital; University of Milan; Université Libre de Bruxelles,Alberto Giovanni Gerli; Fabio Silvio Taccone; Michele Salvagno
RO,Romania,Europe,1,758,Institute of Agricultural Economics Belgrade; Ovidius University; Petroleum & Gas University of Ploieşti,Dumitru Nancu; Ileana Georgiana Gheorghe; J. Subić; Violeta Sima
RS,RS,Unknown,1,758,Institute of Agricultural Economics Belgrade; Ovidius University; Petroleum & Gas University of Ploieşti,Dumitru Nancu; Ileana Georgiana Gheorghe; J. Subić; Violeta Sima
MT,MT,Unknown,1,755,Tilburg University; University of Malta,Albert Gatt; Emiel Krahmer
FI,Finland,Europe,1,567,Bocconi University; Free University of Bozen-Bolzano; Hong Kong Polytechnic University; Mid Sweden University; National Research Tomsk State University; TU Wien; Tomsk Polytechnic University; University of Applied Sciences Ravensburg-Weingarten; University of Eastern Finland; University of Southern California; Virginia Tech,Juho Pesonen; Julia Neidhardt; Markus Zanker; Matthias Fuchs; Rob Law; Rodolfo Baggio; Ulrike Gretzel; Wolfram Höepken; Zheng Xiang
RU,Russia,Europe,1,567,Bocconi University; Free University of Bozen-Bolzano; Hong Kong Polytechnic University; Mid Sweden University; National Research Tomsk State University; TU Wien; Tomsk Polytechnic University; University of Applied Sciences Ravensburg-Weingarten; University of Eastern Finland; University of Southern California; Virginia Tech,Juho Pesonen; Julia Neidhardt; Markus Zanker; Matthias Fuchs; Rob Law; Rodolfo Baggio; Ulrike Gretzel; Wolfram Höepken; Zheng Xiang
BR,Brazil,Latin America and Caribbean,1,519,Australian Institute of Business; Universidade do Vale do Rio dos Sinos,Diane Robyn Kalendra; Fernando de Oliveira Santini; Ingrid Day; Liz Heathcote; Mingwei Sun; Mulyadi Robin; Raouf Ahmad Rather; Sumesh Nair; Tareq Rasul; Wagner Júnior Ladeira
TR,Türkiye,Asia,1,508,Boğaziçi University; Harbin Institute of Technology; Norwegian University of Science and Technology,Hao Luo; Okyay Kaynak; Shen Yin; Xiang Li; Yuchen Jiang
CY,CY,Unknown,1,501,Aaron Marcus and Associates; Alibaba Group (United States); Baidu (China); Chongqing University; Coventry University; Cyprus University of Technology; DEVCOM Army Research Laboratory; DePaul University; FORTH Institute of Computer Science; Foundation for Research and Technology Hellas; Google (United States); Huawei Technologies (China); IBM (United States); Intel (United States); Kyushu University; Missouri University of Science and Technology; Purdue University West Lafayette; San Jose State University; SoarTech (United States); Technische Universität Ilmenau; The Open University of Japan; Tokyo City University; Tokyo University of Science; Towson University; Tsinghua University; United States Army Futures Command; University of Central Florida; University of Crete,Aaron Marcus; Abbas Moallem; Andri Ioannou; Cali Fidopiastis; Constantine Stephanidis; Don Harris; Dylan Schmorrow; Fiona Fui‐Hoon Nah; Gabriele Meiselwitz; Gavriel Salvendy; Gino Fragomeni; Heidi Krömker; Hirohiko Mori; James R. Lewis; Jessie Y. C. Chen; Jia Zhou; Jianming Dong; Keng Siau; Kyeong‐Ah Jeong; Limin Paul Fu; Margherita Antona; Masaaki Kurosu; Norbert Streitz; Panayiotis Zaphiris; Pei‐Luen Patrick Rau; Sakae Yamamoto; Shin’ichi Konomi; Stavroula Ntoa; Vincent G. Duffy; Wentao Wang; Xiaowen Fang; Yinni Guo
JP,Japan,Asia,1,501,Aaron Marcus and Associates; Alibaba Group (United States); Baidu (China); Chongqing University; Coventry University; Cyprus University of Technology; DEVCOM Army Research Laboratory; DePaul University; FORTH Institute of Computer Science; Foundation for Research and Technology Hellas; Google (United States); Huawei Technologies (China); IBM (United States); Intel (United States); Kyushu University; Missouri University of Science and Technology; Purdue University West Lafayette; San Jose State University; SoarTech (United States); Technische Universität Ilmenau; The Open University of Japan; Tokyo City University; Tokyo University of Science; Towson University; Tsinghua University; United States Army Futures Command; University of Central Florida; University of Crete,Aaron Marcus; Abbas Moallem; Andri Ioannou; Cali Fidopiastis; Constantine Stephanidis; Don Harris; Dylan Schmorrow; Fiona Fui‐Hoon Nah; Gabriele Meiselwitz; Gavriel Salvendy; Gino Fragomeni; Heidi Krömker; Hirohiko Mori; James R. Lewis; Jessie Y. C. Chen; Jia Zhou; Jianming Dong; Keng Siau; Kyeong‐Ah Jeong; Limin Paul Fu; Margherita Antona; Masaaki Kurosu; Norbert Streitz; Panayiotis Zaphiris; Pei‐Luen Patrick Rau; Sakae Yamamoto; Shin’ichi Konomi; Stavroula Ntoa; Vincent G. Duffy; Wentao Wang; Xiaowen Fang; Yinni Guo
IL,Israel,Asia,1,98,"Birkbeck, University of London; City University of Hong Kong; Copenhagen Business School; Greensboro College; Grenoble Ecole de Management; Hebrew University of Jerusalem; Institut Européen de Gestion; Lancaster University; Monash University; Queen's University Belfast; University Alliance; University of Bath; University of Birmingham; University of Glasgow; University of Gothenburg; University of Manchester; University of North Carolina at Greensboro; University of Warwick; University of York; Vienna University of Economics and Business",Christina Lubinski; Daniel Muzio; David A. Ellis; Gazi Islam; James Faulconbridge; Julie Gore; M. N. Ravishankar; Michelle Greenwood; Niall MacKenzie; Olivia Brown; Paolo Quattrone; Paul Hibbert; Renate E. Meyer; Riikka M. Sarala; Robert M. Davison; Shuang Ren; Stephanie Decker; Tammar B. Zilber
HU,Hungary,Europe,1,47,Eszterhazy Karoly Catholic University; John von Neumann University; Obuda University; University of Dunaújváros,Attila Kővári
