country_code,country,continent,publications,cited_by_count,institutions,authors
DE,Germany,Europe,6,6883,"Aaron Marcus and Associates; Alibaba Group (United States); Aston University; Baidu (China); Bocconi University; Bournemouth University; Center for Environmental Health; Chongqing University; City University of Hong Kong; College of Charleston; Copenhagen Business School; Coventry University; Cyprus University of Technology; DEVCOM Army Research Laboratory; DePaul University; Delft University of Technology; FORTH Institute of Computer Science; Fore School of Management; Foundation for Research and Technology Hellas; Free University of Bozen-Bolzano; Fresenius (Germany); Friedrich-Alexander-Universität Erlangen-Nürnberg; Georgia State University; Google (United States); Heidelberg University; Helmholtz Zentrum München; Hong Kong Polytechnic University; Huawei Technologies (China); Humans and management in society; IBM (United States); Ideon Innovation (Sweden); Ideon Science Park; Indian Institute of Management Ahmedabad; Indian Institute of Management Bangalore; Indian Institute of Technology Delhi; Intel (United States); King Abdulaziz University; King Fahd University of Petroleum and Minerals; Kyushu University; Laboratoire d'Economie et de Management de Nantes Atlantique; Liverpool John Moores University; Mid Sweden University; Middle Georgia State College; Missouri University of Science and Technology; Montpellier Business School; Mälardalen University; NIIT (India); National Center for Tumor Diseases; National Institute of Technology Tiruchirappalli; National Research Tomsk State University; National Tsing Hua University; National University of Ireland, Maynooth; Northumbria University; Oklahoma State University; Prin. L. N. Welingkar Institute of Management Development and Research; Purdue University West Lafayette; RWTH Aachen University; Radboud University Nijmegen; SKEMA Business School; San Jose State University; Siemens (Germany); SoarTech (United States); Sultan Qaboos University; Swansea University; Symbiosis International University; Södertörn University; TBS Education; TU Wien; Technical University of Munich; Technische Universität Dresden; Technische Universität Ilmenau; The Open University of Japan; Tokyo City University; Tokyo University of Science; Tomsk Polytechnic University; Towson University; Tsinghua University; UNSW Sydney; United States Army Futures Command; Universidad de Zaragoza; University Hospital Carl Gustav Carus; University Hospital Heidelberg; University of Applied Sciences Ravensburg-Weingarten; University of Arkansas at Fayetteville; University of Bedfordshire; University of Bologna; University of Bristol; University of Central Florida; University of Colorado Boulder; University of Crete; University of Eastern Finland; University of Greenwich; University of Johannesburg; University of Louisville; University of Manchester; University of North Carolina at Greensboro; University of Otago; University of Reading; University of Sheffield; University of South Florida; University of Southern California; University of Strathclyde; Virginia Tech; Worcester Polytechnic Institute; Wright State University",Aaron Marcus; Abbas Mardani; Abbas Moallem; Abdullah M. Baabdullah; Adil S. Al-Busaidi; Alex Koohang; Alexander Richter; Ali Nazarpour; Anand Jeyaraj; Andri Ioannou; Arpan Kumar Kar; Bernd Carsten Stahl; Cali Fidopiastis; Carlos Flavián; Chiara Maria Lavinia Löffler; Constantine Stephanidis; Denis Dennehy; Dimitrios Buhalis; Don Harris; Dylan Schmorrow; Emma Slade; Emmanuel Mogaji; Fevzi Okumus; Fiona Fui‐Hoon Nah; Fiona R. Kolbinger; Frank T. Piller; Frantz Rowe; Gabriele Meiselwitz; Gareth H. Davies; Gavriel Salvendy; Giampaolo Viglia; Gino Fragomeni; Gregory Patrick Veldhuizen; Hanaa Albanna; Hannah Sophie Muti; Heidi Krömker; Hirohiko Mori; Ilias O. Pappas; Indranil Bose; Iris Junglas; Jakob Nikolas Kather; James R. Lewis; Jan Clusmann; Jan Pries‐Heje; Janarthanan Balakrishnan; Jan‐Niklas Eckardt; Jeretta Horn Nord; Jessie Y. C. Chen; Jia Zhou; Jianming Dong; Jochen Wirtz; John S. Edwards; Juho Pesonen; Julia Neidhardt; Kai R. Larsen; Keng Siau; Kyeong‐Ah Jeong; Laurence Brooks; Laurie Hughes; Lemuria Carter; Limin Paul Fu; Manju Ahuja; Manoj Tiwari; Marcello Mariani; Margherita Antona; Margherita Pagani; Maria Fischl; Marijn Janssen; Markus Zanker; Masaaki Kurosu; Matthias Fuchs; Mei‐Chih Hu; Michael Wade; Michaela Unger; Mousa Ahmad Albashrawi; Narmin Ghaffari Laleh; Neeraj Pandey; Nir Kshetri; Nishith Pathak; Norbert Streitz; Nripendra P. Rana; Panayiotis Zaphiris; Paul Jones; Paul Latreille; Paul Walton; Pei‐Luen Patrick Rau; Pejvak Oghazi; Rahul Dé; Ramakrishnan Raman; Rameshwar Dubey; Reza Toorajipour; Rob Law; Robert M. Davison; Robin Gauld; Rodolfo Baggio; Rohita Dwivedi; Ryan Wright; Sakae Yamamoto; Samuel Ribeiro‐Navarrete; Sangeeta Khorana; Sascha Kraus; Savvas Papagiannidis; Scott W. Cunningham; Sebastian Gregor Bouschery; Shin’ichi Konomi; Siobhán O’Connor; Sophia J. Wagner; Sophie-Caroline Schwarzkopf; Soumyadeb Chowdhury; Sriparna Basu; Stavroula Ntoa; Sunil Mithas; Suprateek Sarker; Sven Laumer; Sven‐Volker Rehm; Tegwen Malik; Tom Crick; Ulrike Gretzel; Vahid Sohrabpour; Varun Grover; Vera Blažević; Vincent G. Duffy; Vishnupriya Raghavan; Viswanath Venkatesh; Wentao Wang; Wil van der Aalst; Wolfram Höepken; Xiaowen Fang; Yanqing Duan; Yinni Guo; Yogesh K. Dwivedi; Yves Barlette; Zheng Xiang; Zunamys I. Carrero
CN,China,Asia,6,2680,Aaron Marcus and Associates; Alibaba Group (United States); Baidu (China); Boğaziçi University; Central China Normal University; Central South University; Chinese Culture University; Chongqing University; Coventry University; Cyprus University of Technology; DEVCOM Army Research Laboratory; DePaul University; FORTH Institute of Computer Science; Foundation for Research and Technology Hellas; Google (United States); Harbin Institute of Technology; Huawei Technologies (China); IBM (United States); Intel (United States); Kyushu University; Missouri University of Science and Technology; National University of Singapore; North Minzu University; Norwegian University of Science and Technology; Purdue University West Lafayette; Renmin University of China; San Jose State University; SoarTech (United States); Sun Yat-sen University; Technische Universität Ilmenau; The Open University of Japan; Tokyo City University; Tokyo University of Science; Towson University; Tsinghua University; United States Army Futures Command; University of Central Florida; University of Crete; Zhejiang Wanli University,Aaron Marcus; Abbas Moallem; Andri Ioannou; Anran Ma; Bin Zhou; Cali Fidopiastis; Chen Ma; Constantine Stephanidis; Cuiping Song; Don Harris; Dylan Schmorrow; Feng Xiong; Fiona Fui‐Hoon Nah; Gabriele Meiselwitz; Gavriel Salvendy; Gino Fragomeni; Hao Luo; Hao Yang; Heidi Krömker; Hirohiko Mori; James R. Lewis; Jessie Y. C. Chen; Ji-Rong Wen; Jia Zhou; Jiakai Tang; Jianming Dong; Jingsen Zhang; Keng Siau; Kyeong‐Ah Jeong; Lei Wang; Limin Paul Fu; Margherita Antona; Masaaki Kurosu; Min-Ren Yan; Norbert Streitz; Okyay Kaynak; Panayiotis Zaphiris; Pei‐Luen Patrick Rau; Sakae Yamamoto; Shen Yin; Shin’ichi Konomi; Stavroula Ntoa; Sung‐Lin Hsueh; Vincent G. Duffy; Wai Yie Leong; Wayne Xin Zhao; Wentao Wang; Xiang Li; Xiaowen Fang; Xinguo Yu; Xu Chen; Xueyang Feng; Yankai Lin; Yanping Song; Yinni Guo; Yu-Lung Chen; Yuchen Jiang; Zeyu Zhang; Zhewei Wei; Zhiyuan Chen
IN,India,Asia,4,8421,Aston University; Bournemouth University; Capgemini (United Kingdom); City University of Hong Kong; College of Charleston; Copenhagen Business School; Delft University of Technology; Fore School of Management; Foundry (United Kingdom); Free University of Bozen-Bolzano; Friedrich-Alexander-Universität Erlangen-Nürnberg; Georgia State University; Government of Tamil Nadu; Humans and management in society; Indian Institute of Management Ahmedabad; Indian Institute of Management Bangalore; Indian Institute of Management Tiruchirappalli; Indian Institute of Technology Delhi; King Abdulaziz University; King Fahd University of Petroleum and Minerals; Laboratoire d'Economie et de Management de Nantes Atlantique; Liverpool John Moores University; Loughborough University; Middle Georgia State College; Montpellier Business School; NIIT (India); National Institute of Technology Tiruchirappalli; National Tsing Hua University; Northumbria University; Oklahoma State University; Prin. L. N. Welingkar Institute of Management Development and Research; SKEMA Business School; Sultan Qaboos University; Swansea University; Symbiosis International University; TBS Education; Training Programs in Epidemiology and Public Health Interventions Network; UNSW Sydney; Universidad de Zaragoza; University of Arkansas at Fayetteville; University of Bedfordshire; University of Bologna; University of Bradford; University of Bristol; University of Colorado Boulder; University of East Anglia; University of Edinburgh; University of Essex; University of Greenwich; University of Johannesburg; University of Louisville; University of Manchester; University of North Carolina at Greensboro; University of Otago; University of Reading; University of Sheffield; University of South Florida; University of Strathclyde; University of the West of England; Worcester Polytechnic Institute; Wright State University,Abbas Mardani; Abdullah M. Baabdullah; Adil S. Al-Busaidi; Aled Eirug; Alex Koohang; Alexander Richter; Anand Jeyaraj; Annie Tubadji; Arpan Kumar Kar; Banita Lal; Bernd Carsten Stahl; Biagio Lucini; Bianca Kronemann; Carlos Flavián; Crispin Coombs; Denis Dennehy; Dimitrios Buhalis; Elvira Ismagilova; Emma Slade; Emmanuel Mogaji; Fevzi Okumus; Frantz Rowe; Gareth H. Davies; Gert Aarts; Giampaolo Viglia; Hanaa Albanna; Hatice Kizgin; Ilias O. Pappas; Indranil Bose; Iris Junglas; Isa Machado; Jak Spencer; Jan Pries‐Heje; Janarthanan Balakrishnan; Jang Bahadur Singh; Jeretta Horn Nord; Jochen Wirtz; John S. Edwards; Kai R. Larsen; Kenneth Le Meunier‐FitzHugh; Kuttimani Tamilmani; Laurence Brooks; Laurie Hughes; Lemuria Carter; Leslie Caroline Le Meunier-FitzHugh; Manju Ahuja; Manoj Tiwari; Marcello M. Mariani; Marcello Mariani; Margherita Pagani; Marijn Janssen; Mei‐Chih Hu; Michael D. Williams; Michael Wade; Mousa Ahmad Albashrawi; Neeraj Pandey; Nir Kshetri; Nishith Pathak; Nripendra P. Rana; P. Vigneswara Ilavarasan; Paul Jones; Paul Latreille; Paul Walton; Rahul Dé; Ramakrishnan Raman; Rameshwar Dubey; Robert M. Davison; Robin Gauld; Rohita Dwivedi; Rony Medaglia; Ryan Wright; Samuel Ribeiro‐Navarrete; Sangeeta Khorana; Santosh K. Misra; Sascha Kraus; Savvas Papagiannidis; Scott W. Cunningham; Siobhán O’Connor; Soumyadeb Chowdhury; Spyridon Samothrakis; Sriparna Basu; Sujeet Kumar Sharma; Sunil Mithas; Suprateek Sarker; Sven Laumer; Sven‐Volker Rehm; Tegwen Malik; Tom Crick; Varun Grover; Vassilis Galanos; Vishnupriya Raghavan; Viswanath Venkatesh; Vittoria Magrelli; Wil van der Aalst; Yanqing Duan; Yogesh K. Dwivedi; Yves Barlette
DK,Denmark,Europe,4,6042,"Aston University; BI Norwegian Business School; Birkbeck, University of London; Capgemini (United Kingdom); City University of Hong Kong; Copenhagen Business School; Delft University of Technology; Foundry (United Kingdom); Government of Tamil Nadu; Greensboro College; Grenoble Ecole de Management; Hebrew University of Jerusalem; Ideon Innovation (Sweden); Ideon Science Park; Indian Institute of Management Tiruchirappalli; Indian Institute of Technology Delhi; Institut Européen de Gestion; Lancaster University; Loughborough University; Monash University; Mälardalen University; National University of Ireland, Maynooth; Prin. L. N. Welingkar Institute of Management Development and Research; Queen's University Belfast; Siemens (Germany); Swansea University; Symbiosis International University; Södertörn University; Training Programs in Epidemiology and Public Health Interventions Network; University Alliance; University of Bath; University of Bedfordshire; University of Birmingham; University of Bradford; University of East Anglia; University of Edinburgh; University of Essex; University of Glasgow; University of Gothenburg; University of Greenwich; University of Manchester; University of North Carolina at Greensboro; University of Southern Denmark; University of Warwick; University of York; University of the West of England; Vienna University of Economics and Business",Aled Eirug; Ali Nazarpour; Anders Gustafsson; Annie Tubadji; Arpan Kumar Kar; Banita Lal; Biagio Lucini; Bianca Kronemann; Christina Lubinski; Crispin Coombs; Daniel Muzio; David A. Ellis; Elvira Ismagilova; Emmanuel Mogaji; Gazi Islam; Gert Aarts; Hatice Kizgin; Jak Spencer; James Faulconbridge; Jang Bahadur Singh; John S. Edwards; Julie Gore; Kenneth Le Meunier‐FitzHugh; Kuttimani Tamilmani; Laurie Hughes; Leslie Caroline Le Meunier-FitzHugh; M. N. Ravishankar; Maria Fischl; Marijn Janssen; Michael D. Williams; Michelle Greenwood; Niall MacKenzie; Nripendra P. Rana; Olivia Brown; P. Vigneswara Ilavarasan; Paolo Quattrone; Paul Hibbert; Paul Jones; Paul Walton; Pejvak Oghazi; Ramakrishnan Raman; Renate E. Meyer; Reza Toorajipour; Riikka M. Sarala; Robert M. Davison; Rohita Dwivedi; Rony Medaglia; Santosh K. Misra; Shuang Ren; Spyridon Samothrakis; Stephanie Decker; Sujeet Kumar Sharma; Surabhi Verma; Tammar B. Zilber; Tom Crick; Vahid Sohrabpour; Vassilis Galanos; Vishnupriya Raghavan; Yanqing Duan; Yogesh K. Dwivedi
ES,Spain,Europe,4,5286,Aston University; Bournemouth University; City University of Hong Kong; College of Charleston; Delft University of Technology; Fore School of Management; Free University of Bozen-Bolzano; Friedrich-Alexander-Universität Erlangen-Nürnberg; Georgia State University; Humans and management in society; Indian Institute of Management Ahmedabad; Indian Institute of Management Bangalore; Indian Institute of Technology Delhi; King Abdulaziz University; King Fahd University of Petroleum and Minerals; Laboratoire d'Economie et de Management de Nantes Atlantique; Liverpool John Moores University; Middle Georgia State College; Montpellier Business School; NIIT (India); National Institute of Technology Tiruchirappalli; National Tsing Hua University; Northumbria University; Oklahoma State University; Prin. L. N. Welingkar Institute of Management Development and Research; SKEMA Business School; Sultan Qaboos University; Swansea University; Symbiosis International University; TBS Education; UNSW Sydney; Universidad Nacional de Educación a Distancia; Universidad de Granada; Universidad de Huelva; Universidad de Zaragoza; Universitat Politècnica de València; Universitat de València; University of Almería; University of Arkansas at Fayetteville; University of Bedfordshire; University of Bologna; University of Bristol; University of Colorado Boulder; University of Greenwich; University of Johannesburg; University of Louisville; University of Manchester; University of North Carolina at Greensboro; University of Otago; University of Reading; University of Sheffield; University of South Florida; University of Strathclyde; Worcester Polytechnic Institute; Wright State University,Abbas Mardani; Abdullah M. Baabdullah; Adil S. Al-Busaidi; Alex Koohang; Alexander Richter; Alexandra Weinmann; Anand Jeyaraj; Arpan Kumar Kar; Bernd Carsten Stahl; Carlos Flavián; Denis Dennehy; Dimitrios Buhalis; Emilio Abad‐Segura; Emma Slade; Emmanuel Mogaji; Fevzi Okumus; Francisco Perfectti; Frantz Rowe; Gareth H. Davies; Germán Ruipérez García; Giampaolo Viglia; Hanaa Albanna; Ilias O. Pappas; Indranil Bose; Iris Junglas; Isabel Reche; Jan Pries‐Heje; Janarthanan Balakrishnan; Jeretta Horn Nord; Jochen Wirtz; John S. Edwards; Juan C. Infante-Moro; Kai R. Larsen; Laurence Brooks; Laurie Hughes; Lemuria Carter; Manju Ahuja; Manoj Tiwari; Marcello Mariani; Margherita Pagani; Mariana-Daniela González-Zamar; Marijn Janssen; Mei‐Chih Hu; Michael Wade; Mousa Ahmad Albashrawi; Neeraj Pandey; Nir Kshetri; Nishith Pathak; Norat Roig‐Tierno; Norbert Kailer; Nripendra P. Rana; Nuria Chaparro‐Banegas; Paul Jones; Paul Latreille; Paul Walton; Rahul Dé; Ramakrishnan Raman; Rameshwar Dubey; Robert M. Davison; Robin Gauld; Rohita Dwivedi; Ryan Wright; Samuel Ribeiro‐Navarrete; Sangeeta Khorana; Sascha Kraus; Savvas Papagiannidis; Scott W. Cunningham; Siobhán O’Connor; Soumyadeb Chowdhury; Sriparna Basu; Sunil Mithas; Suprateek Sarker; Sven Laumer; Sven‐Volker Rehm; Tegwen Malik; Tom Crick; Varun Grover; Vishnupriya Raghavan; Viswanath Venkatesh; Wil van der Aalst; Yanqing Duan; Yogesh K. Dwivedi; Yves Barlette
UNKNOWN,UNKNOWN,Unknown,4,5128,,Alec Radford; Alethea Power; Alex Nichol; Alex Paino; Alex Ray; Andrew N. Carr; Ariel Herbert-Voss; Bob McGrew; Brooke Chan; Christopher Hesse; Clemens Winter; Cong Doanh Duong; Dario Amodei; Dave Cummings; Ece Kamar; Elizabeth A. Barnes; Eric Horvitz; Evan Morikawa; Ewa Ziemba; Felipe Petroski Such; Fotios Chantzis; Girish Sastry; Greg Brockman; Gretchen Krueger; Grzegorz Mazurek; Hamid Palangi; Harrison Edwards; Harsha Nori; Heewoo Jun; Heidy Khlaaf; Henrique Pondé de Oliveira Pinto; I. Babuschkin; Ilya Sutskever; Jan Leike; Jared Kaplan; Jerry Tworek; Jie Tang; Joanna Ejdys; Joanna Paliszkiewicz; Johannes Gehrke; Joshua Achiam; Jürgen Rudolph; Katie Mayer; Krzysztof Wach; Marco Túlio Ribeiro; Mark Chen; Matthew M. Knight; Matthias Plappert; Michael Petrov; Mikhail Pavlov; Miles Brundage; Mira Murati; Mohammad Bavarian; Nicholas Joseph; Nick Ryder; Nikolas Tezak; Pamela Mishkin; Paweł Korzyński; Peter Lee; Peter Welinder; Philippe Tillet; Qiming Yuan; Raul Puri; Ronen Eldan; Rūta Kazlauskaitė; Sam McCandlish; Samson Tan; Scott Gray; Scott Lundberg; Shannon Tan; Shantanu Jain; Suchir Balaji; Sébastien Bubeck; Varun Chandrasekaran; Vedant Misra; William H. Guss; William S. Saunders; Wojciech Zaremba; Yi Zhang; Yin Tat Lee; Yuanzhi Li; Yuri Burda; Łukasz Kaiser
FR,France,Europe,4,5081,"Association Française de Normalisation; Aston University; Birkbeck, University of London; Birmingham City University; Bournemouth University; Centre Hospitalier Guillaume Régnier; City University of Hong Kong; College of Charleston; Copenhagen Business School; Cranfield University; Delft University of Technology; Fore School of Management; Free University of Bozen-Bolzano; Friedrich-Alexander-Universität Erlangen-Nürnberg; George Washington University; Georgia State University; Greensboro College; Grenoble Ecole de Management; Hebrew University of Jerusalem; Humans and management in society; Hunter Water; Indian Institute of Management Ahmedabad; Indian Institute of Management Bangalore; Indian Institute of Technology Delhi; Institut Européen de Gestion; King Abdulaziz University; King Fahd University of Petroleum and Minerals; King's College London; King's College School; Laboratoire d'Economie et de Management de Nantes Atlantique; Laboratoire de Psychologie et d’Ergonomie Appliquées; Lancaster University; Liverpool John Moores University; Loyola University Chicago; Middle Georgia State College; Monash Institute of Medical Research; Monash University; Montpellier Business School; NEOMA Business School; NIIT (India); National Institute of Technology Tiruchirappalli; National Tsing Hua University; Newcastle University; Northumbria University; Oklahoma State University; Prin. L. N. Welingkar Institute of Management Development and Research; Queen's University Belfast; Rutgers, The State University of New Jersey; SKEMA Business School; Simon Fraser University; Sultan Qaboos University; Swansea University; Symbiosis International University; TBS Education; Tilburg University; Trinity College Dublin; Tulane University; UNSW Sydney; Universidad de Zaragoza; University Alliance; University College Birmingham; University of Arkansas at Fayetteville; University of Bath; University of Bedfordshire; University of Birmingham; University of Bologna; University of Bristol; University of Colorado Boulder; University of Glasgow; University of Gothenburg; University of Greenwich; University of Johannesburg; University of Louisville; University of Manchester; University of North Carolina at Charlotte; University of North Carolina at Greensboro; University of Otago; University of Oxford; University of Reading; University of Sheffield; University of South Florida; University of Strathclyde; University of Warwick; University of York; Université Gustave Eiffel; Université Paris Cité; Utrecht University; Vienna University of Economics and Business; Western University; Worcester Polytechnic Institute; Wright State University",Abbas Mardani; Abdullah M. Baabdullah; Adil S. Al-Busaidi; Alex Koohang; Alexander Richter; Anand Jeyaraj; Anaëlle Camarda; Andrew J. Knoblich; Angelo S. DeNisi; Arpan Kumar Kar; Arup Varma; Ashish Malik; Bernd Carsten Stahl; Branden Thornhill-Miller; Carlos Flavián; Charmi Patel; Christina Lubinski; Cyrille Feybesse; Daniel Muzio; Daniel Sundquist; David A. Ellis; David Guest; Denis Dennehy; Dimitrios Buhalis; Emma Slade; Emmanuel Mogaji; Fang Lee Cooke; Fevzi Okumus; Florence Mourey; Florent Vinchon; Frantz Rowe; Gareth H. Davies; Gazi Islam; Geoffrey Wood; Giampaolo Viglia; Greg J. Bamber; Hanaa Albanna; Herman Aguinis; Ilias O. Pappas; Indranil Bose; Iris Junglas; Jaap Paauwe; James Faulconbridge; Jan Pries‐Heje; Janarthanan Balakrishnan; Jean‐Marie Burkhardt; Jeretta Horn Nord; Jochen Wirtz; John S. Edwards; Jose R. Beltran; Julie Gore; Kai R. Larsen; Laurence Brooks; Laurie Hughes; Lemuria Carter; M. N. Ravishankar; Manju Ahuja; Manoj Tiwari; Marcello Mariani; Margherita Pagani; Marijn Janssen; Mark N. K. Saunders; Maxence Mercier; Mei‐Chih Hu; Michael Wade; Michelle Greenwood; Mousa Ahmad Albashrawi; Myriam Augereau-Landais; Neeraj Pandey; Niall MacKenzie; Nir Kshetri; Nishith Pathak; Nripendra P. Rana; Olivia Brown; Paolo Quattrone; Paul Boselie; Paul Hibbert; Paul Jones; Paul Latreille; Paul Walton; Pawan Budhwar; Prasanta Kumar Dey; Rahul Dé; Ramakrishnan Raman; Rameshwar Dubey; Renate E. Meyer; Riikka M. Sarala; Robert M. Davison; Robin Gauld; Rohita Dwivedi; Rosalie L. Tung; Ryan Wright; Samira Bourgeois‐Bougrine; Samuel Ribeiro‐Navarrete; Sangeeta Khorana; Sascha Kraus; Savvas Papagiannidis; Scott W. Cunningham; Shuang Ren; Siobhán O’Connor; Soumyadeb Chowdhury; Sriparna Basu; Stephanie Decker; Stephanie El Hayek; Steven G. Rogelberg; Sunil Mithas; Suprateek Sarker; Sven Laumer; Sven‐Volker Rehm; Tammar B. Zilber; Tegwen Malik; Tiffany Morisseau; Todd Lubart; Tom Crick; Varun Grover; Vijay Pereira; Vishnupriya Raghavan; Viswanath Venkatesh; Wil van der Aalst; Yanqing Duan; Yogesh K. Dwivedi; Yves Barlette
