country_code,country,continent,publications,cited_by_count,institutions,authors
AU,Australia,Oceania,4,4979,"Aston University; Australian Institute of Business; Birkbeck, University of London; Birmingham City University; Bournemouth University; City University of Hong Kong; College of Charleston; Copenhagen Business School; Cranfield University; Delft University of Technology; Fore School of Management; Free University of Bozen-Bolzano; Friedrich-Alexander-Universität Erlangen-Nürnberg; George Washington University; Georgia State University; Greensboro College; Grenoble Ecole de Management; Hebrew University of Jerusalem; Humans and management in society; Hunter Water; Indian Institute of Management Ahmedabad; Indian Institute of Management Bangalore; Indian Institute of Technology Delhi; Institut Européen de Gestion; King Abdulaziz University; King Fahd University of Petroleum and Minerals; King's College London; King's College School; Laboratoire d'Economie et de Management de Nantes Atlantique; Lancaster University; Liverpool John Moores University; Loyola University Chicago; Middle Georgia State College; Monash Institute of Medical Research; Monash University; Montpellier Business School; NEOMA Business School; NIIT (India); National Institute of Technology Tiruchirappalli; National Tsing Hua University; Newcastle University; Northumbria University; Oklahoma State University; Prin. L. N. Welingkar Institute of Management Development and Research; Queen's University Belfast; Rutgers, The State University of New Jersey; SKEMA Business School; Simon Fraser University; Sultan Qaboos University; Swansea University; Symbiosis International University; TBS Education; Tilburg University; Trinity College Dublin; Tulane University; UNSW Sydney; Universidad de Zaragoza; Universidade do Vale do Rio dos Sinos; University Alliance; University College Birmingham; University of Arkansas at Fayetteville; University of Bath; University of Bedfordshire; University of Birmingham; University of Bologna; University of Bristol; University of Colorado Boulder; University of Glasgow; University of Gothenburg; University of Greenwich; University of Johannesburg; University of Louisville; University of Manchester; University of North Carolina at Charlotte; University of North Carolina at Greensboro; University of Otago; University of Reading; University of Sheffield; University of South Florida; University of Strathclyde; University of Warwick; University of York; Utrecht University; Vienna University of Economics and Business; Western University; Worcester Polytechnic Institute; Wright State University",Abbas Mardani; Abdullah M. Baabdullah; Adil S. Al-Busaidi; Alex Koohang; Alexander Richter; Anand Jeyaraj; Andrew J. Knoblich; Angelo S. DeNisi; Arpan Kumar Kar; Arup Varma; Ashish Malik; Bernd Carsten Stahl; Carlos Flavián; Charmi Patel; Christina Lubinski; Daniel Muzio; David A. Ellis; David Guest; Denis Dennehy; Diane Robyn Kalendra; Dimitrios Buhalis; Emma Slade; Emmanuel Mogaji; Fang Lee Cooke; Fernando de Oliveira Santini; Fevzi Okumus; Frantz Rowe; Gareth H. Davies; Gazi Islam; Geoffrey Wood; Giampaolo Viglia; Greg J. Bamber; Hanaa Albanna; Herman Aguinis; Ilias O. Pappas; Indranil Bose; Ingrid Day; Iris Junglas; Jaap Paauwe; James Faulconbridge; Jan Pries‐Heje; Janarthanan Balakrishnan; Jeretta Horn Nord; Jochen Wirtz; John S. Edwards; Jose R. Beltran; Julie Gore; Kai R. Larsen; Laurence Brooks; Laurie Hughes; Lemuria Carter; Liz Heathcote; M. N. Ravishankar; Manju Ahuja; Manoj Tiwari; Marcello Mariani; Margherita Pagani; Marijn Janssen; Mark N. K. Saunders; Mei‐Chih Hu; Michael Wade; Michelle Greenwood; Mingwei Sun; Mousa Ahmad Albashrawi; Mulyadi Robin; Neeraj Pandey; Niall MacKenzie; Nir Kshetri; Nishith Pathak; Nripendra P. Rana; Olivia Brown; Paolo Quattrone; Paul Boselie; Paul Hibbert; Paul Jones; Paul Latreille; Paul Walton; Pawan Budhwar; Prasanta Kumar Dey; Rahul Dé; Ramakrishnan Raman; Rameshwar Dubey; Raouf Ahmad Rather; Renate E. Meyer; Riikka M. Sarala; Robert M. Davison; Robin Gauld; Rohita Dwivedi; Rosalie L. Tung; Ryan Wright; Samuel Ribeiro‐Navarrete; Sangeeta Khorana; Sascha Kraus; Savvas Papagiannidis; Scott W. Cunningham; Shuang Ren; Siobhán O’Connor; Soumyadeb Chowdhury; Sriparna Basu; Stephanie Decker; Steven G. Rogelberg; Sumesh Nair; Sunil Mithas; Suprateek Sarker; Sven Laumer; Sven‐Volker Rehm; Tammar B. Zilber; Tareq Rasul; Tegwen Malik; Tom Crick; Varun Grover; Vijay Pereira; Vishnupriya Raghavan; Viswanath Venkatesh; Wagner Júnior Ladeira; Wil van der Aalst; Yanqing Duan; Yogesh K. Dwivedi; Yves Barlette
NO,Norway,Europe,4,4130,BI Norwegian Business School; Boğaziçi University; Harbin Institute of Technology; Norwegian University of Science and Technology; Oklahoma State University; SINTEF; SINTEF Digital; University of Southern Denmark,Adil Rasheed; Anders Gustafsson; Emmanouil Papagiannidis; Hao Luo; Ida Merete Enholm; John Krogstie; Okyay Kaynak; Omer San; Patrick Mikalef; Shen Yin; Surabhi Verma; Trond Kvamsdal; Xiang Li; Yuchen Jiang
SE,Sweden,Europe,4,3349,"Birkbeck, University of London; Bocconi University; City University of Hong Kong; Copenhagen Business School; Free University of Bozen-Bolzano; Greensboro College; Grenoble Ecole de Management; Hebrew University of Jerusalem; Hong Kong Polytechnic University; Ideon Innovation (Sweden); Ideon Science Park; Institut Européen de Gestion; Lancaster University; Mid Sweden University; Monash University; Mälardalen University; National Research Tomsk State University; National University of Ireland, Maynooth; Queen's University Belfast; Siemens (Germany); Stockholm School of Economics; Södertörn University; TU Wien; Tomsk Polytechnic University; University Alliance; University of Applied Sciences Ravensburg-Weingarten; University of Bath; University of Birmingham; University of Eastern Finland; University of Geneva; University of Glasgow; University of Gothenburg; University of Manchester; University of North Carolina at Greensboro; University of Southern California; University of Warwick; University of York; Vienna University of Economics and Business; Virginia Tech",Ali Nazarpour; Christina Lubinski; Daniel Muzio; David A. Ellis; Gazi Islam; James Faulconbridge; Juho Pesonen; Julia Neidhardt; Julie Gore; M. N. Ravishankar; Maria Fischl; Markus Zanker; Matthias Fuchs; Michelle Greenwood; Niall MacKenzie; Olivia Brown; Paolo Quattrone; Paul Hibbert; Pejvak Oghazi; Renate E. Meyer; Reza Toorajipour; Riikka M. Sarala; Rob Law; Robert M. Davison; Rodolfo Baggio; Sebastian Krakowski; Sebastian Raisch; Shuang Ren; Stephanie Decker; Tammar B. Zilber; Ulrike Gretzel; Vahid Sohrabpour; Wolfram Höepken; Zheng Xiang
HK,Hong Kong,Asia,3,4278,"Aston University; Birkbeck, University of London; Bocconi University; Bournemouth University; City University of Hong Kong; College of Charleston; Copenhagen Business School; Delft University of Technology; Fore School of Management; Free University of Bozen-Bolzano; Friedrich-Alexander-Universität Erlangen-Nürnberg; Georgia State University; Greensboro College; Grenoble Ecole de Management; Hebrew University of Jerusalem; Hong Kong Polytechnic University; Humans and management in society; Indian Institute of Management Ahmedabad; Indian Institute of Management Bangalore; Indian Institute of Technology Delhi; Institut Européen de Gestion; King Abdulaziz University; King Fahd University of Petroleum and Minerals; Laboratoire d'Economie et de Management de Nantes Atlantique; Lancaster University; Liverpool John Moores University; Mid Sweden University; Middle Georgia State College; Monash University; Montpellier Business School; NIIT (India); National Institute of Technology Tiruchirappalli; National Research Tomsk State University; National Tsing Hua University; Northumbria University; Oklahoma State University; Prin. L. N. Welingkar Institute of Management Development and Research; Queen's University Belfast; SKEMA Business School; Sultan Qaboos University; Swansea University; Symbiosis International University; TBS Education; TU Wien; Tomsk Polytechnic University; UNSW Sydney; Universidad de Zaragoza; University Alliance; University of Applied Sciences Ravensburg-Weingarten; University of Arkansas at Fayetteville; University of Bath; University of Bedfordshire; University of Birmingham; University of Bologna; University of Bristol; University of Colorado Boulder; University of Eastern Finland; University of Glasgow; University of Gothenburg; University of Greenwich; University of Johannesburg; University of Louisville; University of Manchester; University of North Carolina at Greensboro; University of Otago; University of Reading; University of Sheffield; University of South Florida; University of Southern California; University of Strathclyde; University of Warwick; University of York; Vienna University of Economics and Business; Virginia Tech; Worcester Polytechnic Institute; Wright State University",Abbas Mardani; Abdullah M. Baabdullah; Adil S. Al-Busaidi; Alex Koohang; Alexander Richter; Anand Jeyaraj; Arpan Kumar Kar; Bernd Carsten Stahl; Carlos Flavián; Christina Lubinski; Daniel Muzio; David A. Ellis; Denis Dennehy; Dimitrios Buhalis; Emma Slade; Emmanuel Mogaji; Fevzi Okumus; Frantz Rowe; Gareth H. Davies; Gazi Islam; Giampaolo Viglia; Hanaa Albanna; Ilias O. Pappas; Indranil Bose; Iris Junglas; James Faulconbridge; Jan Pries‐Heje; Janarthanan Balakrishnan; Jeretta Horn Nord; Jochen Wirtz; John S. Edwards; Juho Pesonen; Julia Neidhardt; Julie Gore; Kai R. Larsen; Laurence Brooks; Laurie Hughes; Lemuria Carter; M. N. Ravishankar; Manju Ahuja; Manoj Tiwari; Marcello Mariani; Margherita Pagani; Marijn Janssen; Markus Zanker; Matthias Fuchs; Mei‐Chih Hu; Michael Wade; Michelle Greenwood; Mousa Ahmad Albashrawi; Neeraj Pandey; Niall MacKenzie; Nir Kshetri; Nishith Pathak; Nripendra P. Rana; Olivia Brown; Paolo Quattrone; Paul Hibbert; Paul Jones; Paul Latreille; Paul Walton; Rahul Dé; Ramakrishnan Raman; Rameshwar Dubey; Renate E. Meyer; Riikka M. Sarala; Rob Law; Robert M. Davison; Robin Gauld; Rodolfo Baggio; Rohita Dwivedi; Ryan Wright; Samuel Ribeiro‐Navarrete; Sangeeta Khorana; Sascha Kraus; Savvas Papagiannidis; Scott W. Cunningham; Shuang Ren; Siobhán O’Connor; Soumyadeb Chowdhury; Sriparna Basu; Stephanie Decker; Sunil Mithas; Suprateek Sarker; Sven Laumer; Sven‐Volker Rehm; Tammar B. Zilber; Tegwen Malik; Tom Crick; Ulrike Gretzel; Varun Grover; Vishnupriya Raghavan; Viswanath Venkatesh; Wil van der Aalst; Wolfram Höepken; Yanqing Duan; Yogesh K. Dwivedi; Yves Barlette; Zheng Xiang
GR,Greece,Europe,3,1658,Aaron Marcus and Associates; Alibaba Group (United States); Baidu (China); Chongqing University; Coventry University; Cyprus University of Technology; DEVCOM Army Research Laboratory; DePaul University; FORTH Institute of Computer Science; Foundation for Research and Technology Hellas; Google (United States); Huawei Technologies (China); IBM (United States); Intel (United States); Kyushu University; Missouri University of Science and Technology; Purdue University West Lafayette; San Jose State University; SoarTech (United States); Technische Universität Ilmenau; The Open University of Japan; Tokyo City University; Tokyo University of Science; Towson University; Tsinghua University; United States Army Futures Command; University of Central Florida; University of Crete; University of Patras; University of Peloponnese,Aaron Marcus; Abbas Moallem; Andri Ioannou; Cali Fidopiastis; Constantine Stephanidis; Dimitris Mourtzis; Don Harris; Dylan Schmorrow; Fiona Fui‐Hoon Nah; Gabriele Meiselwitz; Gavriel Salvendy; Gino Fragomeni; Heidi Krömker; Hirohiko Mori; James R. Lewis; Jessie Y. C. Chen; Jia Zhou; Jianming Dong; John Angelopoulos; Keng Siau; Konstantinos I. Roumeliotis; Kyeong‐Ah Jeong; Limin Paul Fu; Margherita Antona; Masaaki Kurosu; Nikolaos D. Tselikas; Nikos Panopoulos; Norbert Streitz; Panayiotis Zaphiris; Pei‐Luen Patrick Rau; Sakae Yamamoto; Shin’ichi Konomi; Stavroula Ntoa; Vincent G. Duffy; Wentao Wang; Xiaowen Fang; Yinni Guo
SA,Saudi Arabia,Asia,2,4399,Aston University; Bournemouth University; City University of Hong Kong; College of Charleston; Delft University of Technology; Fore School of Management; Free University of Bozen-Bolzano; Friedrich-Alexander-Universität Erlangen-Nürnberg; Georgia State University; Humans and management in society; Imam Abdulrahman Bin Faisal University; Indian Institute of Management Ahmedabad; Indian Institute of Management Bangalore; Indian Institute of Technology Delhi; King Abdulaziz University; King Fahd Hospital of the University; King Fahd University of Petroleum and Minerals; Laboratoire d'Economie et de Management de Nantes Atlantique; Liverpool John Moores University; Middle Georgia State College; Montpellier Business School; NIIT (India); National Institute of Technology Tiruchirappalli; National Tsing Hua University; Northumbria University; Oklahoma State University; Prin. L. N. Welingkar Institute of Management Development and Research; SKEMA Business School; Sultan Qaboos University; Swansea University; Symbiosis International University; TBS Education; UNSW Sydney; Universidad de Zaragoza; University of Arkansas at Fayetteville; University of Bedfordshire; University of Bologna; University of Bristol; University of Colorado Boulder; University of Greenwich; University of Johannesburg; University of Louisville; University of Manchester; University of North Carolina at Greensboro; University of Otago; University of Reading; University of Sheffield; University of South Florida; University of Strathclyde; Worcester Polytechnic Institute; Wright State University,Abbas Mardani; Abdullah H. Alreedy; Abdullah M. Baabdullah; Adil S. Al-Busaidi; Afnan Almuhanna; Ahmed Al Kuwaiti; Alex Koohang; Alexander Richter; Anand Jeyaraj; Arpan Kumar Kar; Arun Vijay Subbarayalu; Bernd Carsten Stahl; Carlos Flavián; Denis Dennehy; Dhoha Al Muhanna; Dimitrios Buhalis; Emma Slade; Emmanuel Mogaji; Fahad Al‐Muhanna; Fevzi Okumus; Frantz Rowe; Gareth H. Davies; Giampaolo Viglia; Hanaa Albanna; Ilias O. Pappas; Indranil Bose; Iris Junglas; Jan Pries‐Heje; Janarthanan Balakrishnan; Jeretta Horn Nord; Jochen Wirtz; John S. Edwards; Kai R. Larsen; Khalid Nazer; Laurence Brooks; Laurie Hughes; Lemuria Carter; Manju Ahuja; Manoj Tiwari; Marcello Mariani; Margherita Pagani; Marijn Janssen; Mei‐Chih Hu; Michael Wade; Mousa Ahmad Albashrawi; Neeraj Pandey; Nir Kshetri; Nishith Pathak; Nripendra P. Rana; Paul Jones; Paul Latreille; Paul Walton; Rahul Dé; Ramakrishnan Raman; Rameshwar Dubey; Robert M. Davison; Robin Gauld; Rohita Dwivedi; Ryan Wright; Samuel Ribeiro‐Navarrete; Sangeeta Khorana; Sascha Kraus; Savvas Papagiannidis; Scott W. Cunningham; Shaher D AlShehri; Siobhán O’Connor; Soumyadeb Chowdhury; Sriparna Basu; Sunil Mithas; Suprateek Sarker; Sven Laumer; Sven‐Volker Rehm; Tegwen Malik; Tom Crick; Varun Grover; Vishnupriya Raghavan; Viswanath Venkatesh; Wil van der Aalst; Yanqing Duan; Yogesh K. Dwivedi; Yves Barlette
TW,Taiwan,Asia,2,3648,Aston University; Bournemouth University; Chinese Culture University; City University of Hong Kong; College of Charleston; Delft University of Technology; Fore School of Management; Free University of Bozen-Bolzano; Friedrich-Alexander-Universität Erlangen-Nürnberg; Georgia State University; Humans and management in society; Indian Institute of Management Ahmedabad; Indian Institute of Management Bangalore; Indian Institute of Technology Delhi; King Abdulaziz University; King Fahd University of Petroleum and Minerals; Laboratoire d'Economie et de Management de Nantes Atlantique; Liverpool John Moores University; Middle Georgia State College; Montpellier Business School; NIIT (India); National Institute of Technology Tiruchirappalli; National Tsing Hua University; Northumbria University; Oklahoma State University; Prin. L. N. Welingkar Institute of Management Development and Research; SKEMA Business School; Sultan Qaboos University; Sun Yat-sen University; Swansea University; Symbiosis International University; TBS Education; UNSW Sydney; Universidad de Zaragoza; University of Arkansas at Fayetteville; University of Bedfordshire; University of Bologna; University of Bristol; University of Colorado Boulder; University of Greenwich; University of Johannesburg; University of Louisville; University of Manchester; University of North Carolina at Greensboro; University of Otago; University of Reading; University of Sheffield; University of South Florida; University of Strathclyde; Worcester Polytechnic Institute; Wright State University; Zhejiang Wanli University,Abbas Mardani; Abdullah M. Baabdullah; Adil S. Al-Busaidi; Alex Koohang; Alexander Richter; Anand Jeyaraj; Arpan Kumar Kar; Bernd Carsten Stahl; Bin Zhou; Carlos Flavián; Denis Dennehy; Dimitrios Buhalis; Emma Slade; Emmanuel Mogaji; Fevzi Okumus; Frantz Rowe; Gareth H. Davies; Giampaolo Viglia; Hanaa Albanna; Ilias O. Pappas; Indranil Bose; Iris Junglas; Jan Pries‐Heje; Janarthanan Balakrishnan; Jeretta Horn Nord; Jochen Wirtz; John S. Edwards; Kai R. Larsen; Laurence Brooks; Laurie Hughes; Lemuria Carter; Manju Ahuja; Manoj Tiwari; Marcello Mariani; Margherita Pagani; Marijn Janssen; Mei‐Chih Hu; Michael Wade; Min-Ren Yan; Mousa Ahmad Albashrawi; Neeraj Pandey; Nir Kshetri; Nishith Pathak; Nripendra P. Rana; Paul Jones; Paul Latreille; Paul Walton; Rahul Dé; Ramakrishnan Raman; Rameshwar Dubey; Robert M. Davison; Robin Gauld; Rohita Dwivedi; Ryan Wright; Samuel Ribeiro‐Navarrete; Sangeeta Khorana; Sascha Kraus; Savvas Papagiannidis; Scott W. Cunningham; Siobhán O’Connor; Soumyadeb Chowdhury; Sriparna Basu; Sung‐Lin Hsueh; Sunil Mithas; Suprateek Sarker; Sven Laumer; Sven‐Volker Rehm; Tegwen Malik; Tom Crick; Varun Grover; Vishnupriya Raghavan; Viswanath Venkatesh; Wil van der Aalst; Yanqing Duan; Yogesh K. Dwivedi; Yu-Lung Chen; Yves Barlette
CH,Switzerland,Europe,2,3149,"Dana-Farber Cancer Institute; ETH Zurich; Indiana University Bloomington; Institute for Scientific Interchange; Leiden University; Northeastern University; Northwestern University; Stockholm School of Economics; University of California, Merced; University of Chicago; University of Geneva; University of Washington",Albert-Ĺaszló Barabási; Alessandro Vespignani; Alexander M. Petersen; Brian Uzzi; Carl T. Bergstrom; Dashun Wang; Dirk Helbing; Filippo Radicchi; James A. Evans; Katy Börner; Ludo Waltman; Roberta Sinatra; Santo Fortunato; Sebastian Krakowski; Sebastian Raisch; Staša Milojević
IE,Ireland,Europe,2,1644,"Aston University; Birmingham City University; Copenhagen Business School; Cranfield University; George Washington University; Hunter Water; Ideon Innovation (Sweden); Ideon Science Park; King's College London; King's College School; Loyola University Chicago; Monash Institute of Medical Research; Monash University; Mälardalen University; NEOMA Business School; National University of Ireland, Maynooth; Newcastle University; Queen's University Belfast; Rutgers, The State University of New Jersey; Siemens (Germany); Simon Fraser University; Södertörn University; TBS Education; Tilburg University; Trinity College Dublin; Tulane University; University College Birmingham; University of Bath; University of Birmingham; University of North Carolina at Charlotte; University of Reading; Utrecht University; Western University",Ali Nazarpour; Andrew J. Knoblich; Angelo S. DeNisi; Arup Varma; Ashish Malik; Charmi Patel; David Guest; Fang Lee Cooke; Geoffrey Wood; Greg J. Bamber; Herman Aguinis; Jaap Paauwe; Jose R. Beltran; Maria Fischl; Mark N. K. Saunders; Paul Boselie; Pawan Budhwar; Pejvak Oghazi; Prasanta Kumar Dey; Reza Toorajipour; Rosalie L. Tung; Savvas Papagiannidis; Shuang Ren; Soumyadeb Chowdhury; Stephanie Decker; Steven G. Rogelberg; Vahid Sohrabpour; Vijay Pereira
CA,Canada,North America,2,1260,"Aston University; Birmingham City University; Cranfield University; George Washington University; Hunter Water; King's College London; King's College School; Loyola University Chicago; Monash Institute of Medical Research; Monash University; NEOMA Business School; Newcastle University; Queen's University Belfast; Rutgers, The State University of New Jersey; Simon Fraser University; TBS Education; Tilburg University; Trinity College Dublin; Tulane University; University College Birmingham; University of Bath; University of Birmingham; University of North Carolina at Charlotte; University of Reading; Utrecht University; Western University; York University",Andrew J. Knoblich; Angelo S. DeNisi; Arup Varma; Ashish Malik; Charmi Patel; David Guest; Fang Lee Cooke; Geoffrey Wood; Greg J. Bamber; Herman Aguinis; Iuliia Kotseruba; Jaap Paauwe; John K. Tsotsos; Jose R. Beltran; Mark N. K. Saunders; Paul Boselie; Pawan Budhwar; Prasanta Kumar Dey; Rosalie L. Tung; Savvas Papagiannidis; Shuang Ren; Soumyadeb Chowdhury; Stephanie Decker; Steven G. Rogelberg; Vijay Pereira
AT,Austria,Europe,2,665,"Birkbeck, University of London; Bocconi University; City University of Hong Kong; Copenhagen Business School; Free University of Bozen-Bolzano; Greensboro College; Grenoble Ecole de Management; Hebrew University of Jerusalem; Hong Kong Polytechnic University; Institut Européen de Gestion; Lancaster University; Mid Sweden University; Monash University; National Research Tomsk State University; Queen's University Belfast; TU Wien; Tomsk Polytechnic University; University Alliance; University of Applied Sciences Ravensburg-Weingarten; University of Bath; University of Birmingham; University of Eastern Finland; University of Glasgow; University of Gothenburg; University of Manchester; University of North Carolina at Greensboro; University of Southern California; University of Warwick; University of York; Vienna University of Economics and Business; Virginia Tech",Christina Lubinski; Daniel Muzio; David A. Ellis; Gazi Islam; James Faulconbridge; Juho Pesonen; Julia Neidhardt; Julie Gore; M. N. Ravishankar; Markus Zanker; Matthias Fuchs; Michelle Greenwood; Niall MacKenzie; Olivia Brown; Paolo Quattrone; Paul Hibbert; Renate E. Meyer; Riikka M. Sarala; Rob Law; Robert M. Davison; Rodolfo Baggio; Shuang Ren; Stephanie Decker; Tammar B. Zilber; Ulrike Gretzel; Wolfram Höepken; Zheng Xiang
SG,Singapore,Asia,2,487,Central China Normal University; National University of Singapore; Yale-NUS College,Anran Ma; Feng Xiong; Nancy W. Gleason; Wai Yie Leong; Xinguo Yu
NZ,New Zealand,Oceania,1,3613,Aston University; Bournemouth University; City University of Hong Kong; College of Charleston; Delft University of Technology; Fore School of Management; Free University of Bozen-Bolzano; Friedrich-Alexander-Universität Erlangen-Nürnberg; Georgia State University; Humans and management in society; Indian Institute of Management Ahmedabad; Indian Institute of Management Bangalore; Indian Institute of Technology Delhi; King Abdulaziz University; King Fahd University of Petroleum and Minerals; Laboratoire d'Economie et de Management de Nantes Atlantique; Liverpool John Moores University; Middle Georgia State College; Montpellier Business School; NIIT (India); National Institute of Technology Tiruchirappalli; National Tsing Hua University; Northumbria University; Oklahoma State University; Prin. L. N. Welingkar Institute of Management Development and Research; SKEMA Business School; Sultan Qaboos University; Swansea University; Symbiosis International University; TBS Education; UNSW Sydney; Universidad de Zaragoza; University of Arkansas at Fayetteville; University of Bedfordshire; University of Bologna; University of Bristol; University of Colorado Boulder; University of Greenwich; University of Johannesburg; University of Louisville; University of Manchester; University of North Carolina at Greensboro; University of Otago; University of Reading; University of Sheffield; University of South Florida; University of Strathclyde; Worcester Polytechnic Institute; Wright State University,Abbas Mardani; Abdullah M. Baabdullah; Adil S. Al-Busaidi; Alex Koohang; Alexander Richter; Anand Jeyaraj; Arpan Kumar Kar; Bernd Carsten Stahl; Carlos Flavián; Denis Dennehy; Dimitrios Buhalis; Emma Slade; Emmanuel Mogaji; Fevzi Okumus; Frantz Rowe; Gareth H. Davies; Giampaolo Viglia; Hanaa Albanna; Ilias O. Pappas; Indranil Bose; Iris Junglas; Jan Pries‐Heje; Janarthanan Balakrishnan; Jeretta Horn Nord; Jochen Wirtz; John S. Edwards; Kai R. Larsen; Laurence Brooks; Laurie Hughes; Lemuria Carter; Manju Ahuja; Manoj Tiwari; Marcello Mariani; Margherita Pagani; Marijn Janssen; Mei‐Chih Hu; Michael Wade; Mousa Ahmad Albashrawi; Neeraj Pandey; Nir Kshetri; Nishith Pathak; Nripendra P. Rana; Paul Jones; Paul Latreille; Paul Walton; Rahul Dé; Ramakrishnan Raman; Rameshwar Dubey; Robert M. Davison; Robin Gauld; Rohita Dwivedi; Ryan Wright; Samuel Ribeiro‐Navarrete; Sangeeta Khorana; Sascha Kraus; Savvas Papagiannidis; Scott W. Cunningham; Siobhán O’Connor; Soumyadeb Chowdhury; Sriparna Basu; Sunil Mithas; Suprateek Sarker; Sven Laumer; Sven‐Volker Rehm; Tegwen Malik; Tom Crick; Varun Grover; Vishnupriya Raghavan; Viswanath Venkatesh; Wil van der Aalst; Yanqing Duan; Yogesh K. Dwivedi; Yves Barlette
